<?xml version="1.0" encoding="UTF-8"?>

<checkpoints
	xmlns="http://www.aries.org/validate"
	xmlns:xsi="http://www.w3.org/2001/XMLSchema-instance"
	xsi:schemaLocation="http://www.aries.org/validate file:/workspace/ARIES2/aries-validate/src/main/resources/schema/aries-validate-1.0.xsd">


	<checkpoint>
		<name>id</name>
		<condition>
			<type>notNull</type>
			<exception>org.aries.AssertionFailure</exception>
			<message>Id must be specified</message>
		</condition>
	</checkpoint>


	<checkpoint>
		<name>event</name>
		<condition>
			<type>notNull</type>
			<exception>org.aries.AssertionFailure</exception>
			<message>Event must be specified</message>
		</condition>
		<condition>
			<type>notEmpty</type>
			<expression>$event/date</expression>
			<exception>org.aries.AssertionFailure</exception>
			<message>Event/date must be specified</message>
		</condition>
		<condition>
			<type>notEmpty</type>
			<expression>$event/message</expression>
			<exception>org.aries.AssertionFailure</exception>
			<message>Event/message must be specified</message>
		</condition>
	</checkpoint>


	<checkpoint>
		<name>itemId</name>
		<condition>
			<type>notNull</type>
			<exception>org.aries.AssertionFailure</exception>
			<message>ItemId must be specified</message>
		</condition>
	</checkpoint>


	<checkpoint>
		<name>item</name>
		<condition>
			<type>notNull</type>
			<exception>org.aries.AssertionFailure</exception>
			<message>Item must be specified</message>
		</condition>
		<condition>
			<type>notEmpty</type>
			<expression>$item/id</expression>
			<exception>org.aries.AssertionFailure</exception>
			<message>Item/id must be specified</message>
		</condition>
	</checkpoint>


</checkpoints>
